<?xml version="1.0" encoding="UTF-8"?>
<database xmlns:xsi="http://www.w3.org/2001/XMLSchema-instance"
    xsi:noNamespaceSchemaLocation="../../../../application/database/schema.xsd">
    <table engine="InnoDB" name="art_timecontrol" since="2.3.12">
        <field default="null" name="idartlang" type="int(10) unsigned" nullable="false"
            primary="true">
            <constraint column="idartlang" ondelete="cascade" onupdate="restrict" table="art_lang"/>
        </field>
        <field default="null" name="timea" type="datetime" nullable="true"/>
        <field default="null" name="statusa" type="tinyint(1)" nullable="false"/>
        <field default="null" name="timeb" type="datetime" nullable="true"/>
        <field default="null" name="statusb" type="tinyint(1)" nullable="false"/>
    </table>
</database>
