<?xml version="1.0" encoding="UTF-8"?>
<database xmlns:xsi="http://www.w3.org/2001/XMLSchema-instance" xsi:noNamespaceSchemaLocation="schema.xsd">
    <table engine="InnoDB" name="moraso_config" since="1.5.0">
        <field name="id" type="int(10) unsigned" nullable="false" default="null"  primary="true" autoincrement="true" />
        <field name="config" type="varchar (255)" />
        <field name="env" type="varchar (255)" />
        <field name="identifier" type="varchar (255)" />
        <field name="value" type="varchar (255)" />
        
        <index columns="config,env,identifier" type="unique" name="un_config_env_identifier" />
    </table>
</database>
