<?xml version="1.0" encoding="UTF-8"?>
<database xmlns:xsi="http://www.w3.org/2001/XMLSchema-instance"
    xsi:noNamespaceSchemaLocation="file:/home/kummer/workspace/org.aitsu.dev/application/database/schema.xsd">
    <table engine="InnoDB" name="isabern_adresse" since="IsaBern Adressen 1.0">
        <field default="null" name="id" type="int(10) unsigned" nullable="false" primary="true"/>
        <field default="null" name="firma" type="varchar(255)" nullable="true"/>
        <field default="null" name="strasse" type="varchar(255)" nullable="true"/>
        <field default="null" name="plz" type="varchar(10)" nullable="true"/>
        <field default="null" name="ort" type="varchar(255)" nullable="true"/>
        <field default="null" name="nachname" type="varchar(255)" nullable="true"/>
        <field default="null" name="vorname" type="varchar(255)" nullable="true"/>
        <field default="null" name="modified" type="datetime" nullable="false"/>
    </table>
    <table engine="InnoDB" name="isabern_kategorie" since="IsaBern Adressen 1.0">
        <field default="null" name="id" type="int(10) unsigned" nullable="false" primary="true"/>
        <field default="null" name="bezeichner" type="varchar(255)" nullable="false"/>
        <field default="null" name="modified" type="datetime" nullable="false"/>
    </table>
    <table engine="InnoDB" name="isabern_rubrik" since="IsaBern Adressen 1.0">
        <field default="null" name="id" type="int(10) unsigned" nullable="false" primary="true"/>
        <field default="null" name="bezeichner" type="varchar(255)" nullable="false"/>
        <field default="null" name="kategorie" type="int(10) unsigned" nullable="true">
            <constraint column="id" ondelete="cascade" onupdate="no action"
                table="isabern_kategorie"/>
        </field>
        <field default="null" name="modified" type="datetime" nullable="false"/>
    </table>
    <table engine="InnoDB" name="isabern_angebot" since="IsaBern Adressen 1.0">
        <field default="null" name="id" type="int(10) unsigned" nullable="false" primary="true"/>
        <field default="null" name="bezeichner" type="varchar(255)" nullable="false"/>
        <field default="null" name="modified" type="datetime" nullable="false"/>
    </table>
    <table engine="InnoDB" name="isabern_adresse_angebot" since="IsaBern Adressen 1.0">
        <field default="null" name="adresse" type="int(10) unsigned" nullable="false" primary="true">
            <constraint column="id" ondelete="cascade" onupdate="no action" table="isabern_adresse"
            />
        </field>
        <field default="null" name="angebot" type="int(10) unsigned" nullable="false" primary="true">
            <constraint column="id" ondelete="cascade" onupdate="no action" table="isabern_angebot"
            />
        </field>
        <field default="null" name="modified" type="datetime" nullable="false"/>
    </table>
    <table engine="InnoDB" name="isabern_zielgruppe" since="IsaBern Adressen 1.0">
        <field default="null" name="id" type="int(10) unsigned" nullable="false" primary="true"/>
        <field default="null" name="bezeichner" type="varchar(255)" nullable="false"/>
        <field default="null" name="modified" type="datetime" nullable="false"/>
    </table>
    <table engine="InnoDB" name="isabern_adresse_zielgruppe" since="IsaBern Adressen 1.0">
        <field default="null" name="adresse" type="int(10) unsigned" nullable="false" primary="true">
            <constraint column="id" ondelete="cascade" onupdate="no action" table="isabern_adresse"
            />
        </field>
        <field default="null" name="zielgruppe" type="int(10) unsigned" nullable="false"
            primary="true">
            <constraint column="id" ondelete="cascade" onupdate="no action"
                table="isabern_zielgruppe"/>
        </field>
        <field default="null" name="modified" type="datetime" nullable="false"/>
    </table>
    <table engine="InnoDB" name="isabern_adresse_katgorie_rubrik" since="IsaBern Adressen 1.0">
        <field default="null" name="adresse" type="int(10) unsigned" nullable="false" primary="true">
            <constraint column="id" ondelete="cascade" onupdate="no action" table="isabern_adresse"
            />
        </field>
        <field default="null" name="kategorie" type="int(10) unsigned" nullable="false"
            primary="true">
            <constraint column="id" ondelete="cascade" onupdate="no action"
                table="isabern_kategorie"/>
        </field>
        <field default="null" name="rubrik" type="int(10) unsigned" nullable="false" primary="true">
            <constraint column="id" ondelete="cascade" onupdate="no action" table="isabern_rubrik"/>
        </field>
        <field default="null" name="modified" type="datetime" nullable="false"/>
    </table>
</database>
