<?xml version="1.0" encoding="UTF-8"?>
<database xmlns:xsi="http://www.w3.org/2001/XMLSchema-instance"
    xsi:noNamespaceSchemaLocation="schema.xsd">
    <table name="placeholder" engine="InnoDB" since="2.3.0.1">
        <field name="id" type="int(10) unsigned" default="null" autoincrement="true" primary="true" />
        <field name="identifier" type="varchar(255)" default="null" />
    </table>
    
    <table name="placeholder_values" engine="InnoDB" since="2.3.0.1">
        <field name="id" type="int(10) unsigned" default="null" autoincrement="true" primary="true" />
        <field name="placeholderid" type="int(10) unsigned" default="null">
            <constraint table="placeholder" column="id" onupdate="restrict" ondelete="cascade"/>
        </field>
        <field name="idlang" type="int(10) unsigned" default="null">
            <constraint table="lang" column="idlang" onupdate="restrict" ondelete="cascade"/>
        </field>
        <field name="value" type="text" default="null" />
    </table>
</database>
