<?xml version="1.0" encoding="UTF-8"?>
<database xmlns:xsi="http://www.w3.org/2001/XMLSchema-instance" xsi:noNamespaceSchemaLocation="schema.xsd">     
    <table name="art_has_categorization" engine="InnoDB">
        <field name="id_categorization" type="int(10) unsigned" default="null" autoincrement="true" primary="true" /> 
        
        <field name="id_art" type="int(10) unsigned" default="null" primary="true">
            <constraint table="art" column="idart" onupdate="restrict" ondelete="cascade"/>
        </field>
        
        <field name="id_category" type="int(10) unsigned" default="null" primary="true">
            <constraint table="categorization" column="id_category" onupdate="restrict" ondelete="cascade"/>
        </field>
    </table>
    
    <table name="categorization" engine="InnoDB">        
        <field name="id_category" type="int(10) unsigned" default="null" autoincrement="true" primary="true" /> 
        <field name="name" type="varchar(255)" default="null" />
    </table>
</database>