<?xml version="1.0" encoding="UTF-8"?>
<database xmlns:xsi="http://www.w3.org/2001/XMLSchema-instance"
    xsi:noNamespaceSchemaLocation="schema.xsd">
    <table name="tracking_customer" engine="InnoDB">
        <field name="customerid" type="int(10) unsigned" default="null" autoincrement="true"
            primary="true"/>
        <field name="identifier" type="varchar(255)" default="null"/>
        <field name="active" type="tinyint(4)" default="1"/>
    </table>
    <table name="tracking_project" engine="InnoDB">
        <field name="projectid" type="int(10) unsigned" default="null" autoincrement="true"
            primary="true"/>
        <field name="customerid" type="int(10) unsigned" default="null">
            <constraint table="tracking_customer" column="customerid" onupdate="restrict"
                ondelete="cascade"/>
        </field>
        <field name="identifier" type="varchar(255)" default="null"/>
        <field name="startdate" type="date" default="null"/>
        <field name="enddate" type="date" default="null"/>
        <index name="customerid" columns="customerid" unique="false"/>
    </table>
    <table name="tracking_track" engine="InnoDB">
        <field name="trackid" type="int(10) unsigned" default="null" autoincrement="true"
            primary="true"/>
        <field name="projectid" type="int(10) unsigned" default="null">
            <constraint table="tracking_project" column="projectid" onupdate="restrict"
                ondelete="cascade"/>
        </field>
        <field name="typeid" type="int(10) unsigned" default="null">
            <constraint table="tracking_type" column="typeid" onupdate="restrict"
                ondelete="set null"/>
        </field>
        <field name="userid" type="int(10) unsigned" default="null">
            <constraint table="acl_user" column="userid" onupdate="restrict" ondelete="cascade"/>
        </field>
        <field name="title" type="varchar(255)" default="null"/>
        <field name="description" type="text" default="null"/>
        <field name="closed" type="timestamp" default="null"/>
        <index name="typeid" columns="typeid" unique="false"/>
        <index name="projectid" columns="projectid" unique="false"/>
        <index name="userid" columns="userid" unique="false"/>
    </table>
    <table name="tracking_type" engine="InnoDB">
        <field name="typeid" type="int(10) unsigned" default="null" autoincrement="true"
            primary="true"/>
        <field name="identifier" type="varchar(255)" default="null"/>
    </table>
</database>
