<?xml version="1.0" encoding="UTF-8"?>
<database xmlns:xsi="http://www.w3.org/2001/XMLSchema-instance" xsi:noNamespaceSchemaLocation="schema.xsd">     
    <table name="eav_entity" engine="InnoDB" since="">
        <field name="entity_id" type="int(10) unsigned" default="null" autoincrement="true" primary="true" /> 
    </table>

    <table name="eav_entity_attribute" engine="InnoDB" since="">
        <field name="entity_attribute_id" type="int(10) unsigned" default="null" autoincrement="true" primary="true" /> 
        
        <field name="entity_id" type="int(10) unsigned" default="null"> 
            <constraint table="eav_entity" column="entity_id" onupdate="restrict" ondelete="cascade"/>
        </field>

        <field name="attribute_id" type="int(10) unsigned" default="null"> 
            <constraint table="eav_attribute" column="attribute_id" onupdate="restrict" ondelete="cascade"/>
        </field>
    </table>
    
    <table name="eav_attribute" engine="InnoDB" since="">
        <field name="attribute_id" type="int(10) unsigned" default="null" autoincrement="true" primary="true" /> 
        <field name="attribute_alias" type="varchar(255)" default="null" />
        <field name="attribute_set_id" type="int(10) unsigned" default="null">
            <constraint table="eav_attribute_set" column="attribute_set_id" onupdate="restrict" ondelete="cascade"/>
        </field>
    </table>
    
    <table name="eav_attribute_set" engine="InnoDB" since="">
        <field name="attribute_set_id" type="int(10) unsigned" default="null" autoincrement="true" primary="true" /> 
        <field name="attribute_set_name" type="varchar(255)" default="null" />
    </table>
 
    <table name="eav_value" engine="InnoDB" since="">
        <field name="value_id" type="int(10) unsigned" default="null" autoincrement="true" primary="true" /> 
        
        <field name="entity_attribute_id" type="int(10) unsigned" default="null"> 
            <constraint table="eav_entity_attribute" column="entity_attribute_id" onupdate="restrict" ondelete="cascade"/>
        </field>
    </table>
    
    <table name="eav_value_string" engine="InnoDB" since="">
        <field name="value_id" type="int(10) unsigned" default="null" primary="true">
            <constraint table="eav_value" column="value_id" onupdate="restrict" ondelete="cascade"/>
        </field>
        <field name="value" type="varchar(255)" default="null" />
    </table>
    
    <table name="eav_value_integer" engine="InnoDB" since="">
        <field name="value_id" type="int(10) unsigned" default="null" primary="true">
            <constraint table="eav_value" column="value_id" onupdate="restrict" ondelete="cascade"/>
        </field>
        <field name="value" type="int" default="null" />
    </table>
    
    <table name="eav_value_float" engine="InnoDB" since="">
        <field name="value_id" type="int(10) unsigned" default="null" primary="true">
            <constraint table="eav_value" column="value_id" onupdate="restrict" ondelete="cascade"/>
        </field>
        <field name="value" type="float" default="null" />
    </table>
</database>